GENENAME,seqnames,start,end,width,strand,LOCATION,LOCSTART,LOCEND,QUERYID,TXID,CDSID,GENEID,PRECEDEID,FOLLOWID,CSQ,phenotype_description,strain_name,name_1006,goslim_goa_description,reactome,biogrid,rnacentral,rfam,transcript_appris,transcript_tsl,arrayexpress
Ext1,chr15,53139288,53139288,1,+,promoter,,,44,110941,,,,,"G|intron_variant|MODIFIER|Ext1|ENSMUSG00000061731|Transcript|ENSMUST00000077273|protein_coding||1/10||||||||||-1||MGI|||4.600|",abnormal developmental patterning|abnormal embryonic tissue morphology|abnormal extraembryonic tissue morphology|abnormal eye morphology|abnormal limb morphology|abnormal long bone epiphyseal plate proliferative zone|abnormal skeleton morphology|absent mesoderm|decreased embryo size|disorganized embryonic tissue|embryonic lethality|embryonic lethality between implantation and somite formation complete penetrance|failure of primitive streak formation|failure to gastrulate|increased osteochondroma incidence|no abnormal phenotype detected|premature death|prenatal lethality complete penetrance,"",integral component of membrane|glycosyltransferase activity|endoplasmic reticulum|protein glycosylation|glucuronosyltransferase activity|heparan sulfate proteoglycan biosynthetic process|gene expression|canonical Wnt signaling pathway|hematopoietic stem cell differentiation|multicellular organism growth|BMP signaling pathway|cell morphogenesis|regulation of blood pressure|ossification|cell population proliferation|cellular response to virus|response to virus|glandular epithelial cell differentiation|social behavior|"synaptic transmission, glutamatergic"|synapse|membrane|transferase activity|Golgi membrane|Golgi apparatus|metal ion binding|endoplasmic reticulum membrane|protein homodimerization activity|brain development|endoderm development|sulfation|protein heterodimerization activity|protein catabolic process|protein-containing complex assembly|hematopoietic progenitor cell differentiation|optic nerve development|bone resorption|hematopoietic stem cell homeostasis|collagen fibril organization|chondrocyte differentiation|neuron projection development|smoothened signaling pathway|cranial skeletal system development|cell adhesion|cell adhesion mediated by integrin|blood vessel remodeling|olfactory bulb development|epithelium development|fibroblast growth factor receptor signaling pathway|cellular response to fibroblast growth factor stimulus|tight junction organization|gastrulation|cell surface receptor signaling pathway|acetylglucosaminyltransferase activity|sodium ion homeostasis|stem cell division|vocalization behavior|cell fate commitment|ossification involved in bone maturation|chondrocyte proliferation|antigen processing and presentation|bone morphogenesis|dendritic cell migration|heart contraction|epithelial tube branching involved in lung morphogenesis|cellular response to BMP stimulus|axon guidance|hair cycle process|vasodilation|heparin biosynthetic process|motor behavior|wound healing|TNFSF11-mediated signaling pathway|glycosaminoglycan biosynthetic process|hair follicle morphogenesis|endochondral ossification|basement membrane organization|proteoglycan biosynthetic process|leukocyte tethering or rolling|limb joint morphogenesis|endochondral bone morphogenesis|glomerular basement membrane development|cartilage development involved in endochondral bone morphogenesis|mesoderm development|vacuole organization|response to light intensity|fear response|mesenchyme development|embryonic morphogenesis|neural crest cell differentiation|podocyte differentiation|multicellular organismal water homeostasis|developmental growth involved in morphogenesis|sebaceous gland development|response to growth factor|endochondral bone growth|mesenchymal cell differentiation involved in bone development|heparin metabolic process|glucuronosyl-N-acetylglucosaminyl-proteoglycan 4-alpha-N-acetylglucosaminyltransferase activity|N-acetylglucosaminyl-proteoglycan 4-beta-glucuronosyltransferase activity|"heparan sulfate proteoglycan biosynthetic process, polysaccharide chain biosynthetic process"|cellular polysaccharide biosynthetic process|fluid transport|stomach development|hypersensitivity|heart field specification|chondrocyte hypertrophy|cellular component organization|chondroitin sulfate metabolic process|lymphocyte adhesion to endothelial cell of high endothelial venule|smoothened signaling pathway involved in lung development|sweat gland development|perichondral bone morphogenesis|dendrite self-avoidance|response to heparin|embryonic skeletal joint development|lymphocyte migration into lymphoid organs|hematopoietic stem cell migration to bone marrow|bone growth|response to leukemia inhibitory factor,catalytic activity|transferase activity|organelle|endoplasmic reticulum|carbohydrate derivative metabolic process|protein modification process|protein glycosylation|signaling|immune system process|anatomical structure development|cell differentiation|circulatory system process|Golgi apparatus|sulfur compound metabolic process|protein catabolic process|protein-containing complex assembly|extracellular matrix organization|cell adhesion|cell junction organization|metal ion homeostasis|cell motility|wound healing|carbohydrate metabolic process|inflammatory response,R-MMU-71387|R-MMU-1630316|R-MMU-1430728|R-MMU-2022928|""|R-MMU-1638091,199556|,"",,principal1|"",tsl1 (assigned to previous version 8)|tsl3 (assigned to previous version 1)|tsl5 (assigned to previous version 7),ENSMUSG00000061731
Gtf2a1,chr12,91559782,91559782,1,+,promoter,,,34,95284,,,,,"G|missense_variant|MODERATE|Gtf2a1|ENSMUSG00000020962|Transcript|ENSMUST00000021345|protein_coding|9/9||||1544|1099|367|Y/H|Tat/Cat|||-1||MGI||deleterious(0)|1.280|",increased total body fat amount|preweaning lethality complete penetrance|abnormal spermatid morphology|abnormal suckling behavior|abnormal testis morphology|arrest of spermiogenesis|azoospermia|decreased testis weight|increased male germ cell apoptosis|male infertility|neonatal lethality incomplete penetrance|small seminiferous tubules,C57BL/6N|"",transcription initiation at RNA polymerase II promoter|transcription factor TFIIA complex|nucleus|protein binding|positive regulation of transcription by RNA polymerase II|cytosol|cytoplasm|transcription by RNA polymerase II|nucleoplasm|DNA binding|protein heterodimerization activity|RNA polymerase II general transcription initiation factor activity|positive regulation of transcription initiation by RNA polymerase II|transcription factor TFIID complex|RNA polymerase II-specific DNA-binding transcription factor binding|RNA polymerase II preinitiation complex assembly|RNA polymerase II core promoter sequence-specific DNA binding|RNA polymerase II general transcription initiation factor binding|TBP-class protein binding|transcription preinitiation complex,DNA-templated transcription|organelle|nucleus|nucleoplasm|regulation of DNA-templated transcription|cytosol|DNA binding|general transcription initiation factor activity|protein-containing complex assembly,""|R-MMU-73857|R-MMU-8939211|R-MMU-9006931|R-MMU-9018519|R-MMU-74160|R-MMU-162582|R-MMU-73776|R-MMU-6807505|R-MMU-76042|R-MMU-674695|R-MMU-75953|R-MMU-73779,|219952,"",,""|principal1,tsl1 (assigned to previous version 6)|tsl1 (assigned to previous version 13)|tsl3 (assigned to previous version 1),ENSMUSG00000020962
Luzp1,chr4,136543409,136543409,1,+,coding,2942,2942,12,29441,51792,269593,,,"G|missense_variant|MODERATE|Luzp1|ENSMUSG00000001089|Transcript|ENSMUST00000170102|protein_coding|4/5||||3339|2942|981|L/R|cTc/cGc|||1||MGI||deleterious(0.01)|-0.160|",abnormal hindbrain morphology|abnormal neural fold morphology|abnormal pons morphology|abnormal rhombic lip morphology|abnormal roof plate morphology|anencephaly|cleft secondary palate|cyanosis|double outlet right ventricle|enlarged brain ventricles|exencephaly|failure of eyelid fusion|incomplete rostral neuropore closure|increased hindbrain apoptosis|omphalocele|palatal shelves fail to meet at midline|perinatal lethality complete penetrance|prenatal lethality incomplete penetrance|transposition of great arteries|ventricular septal defect,"",molecular_function|nucleus|cytoplasm|microtubule organizing center|cytoskeleton|centrosome|artery development|ventricular septum development|neural fold bending,organelle|nucleus|cytoskeleton|microtubule organizing center|anatomical structure development,"",234675|,"",,principal1|"",tsl1 (assigned to previous version 4)|tsl5 (assigned to previous version 2)|tsl5 (assigned to previous version 8)|tsl1 (assigned to previous version 6)|tsl2 (assigned to previous version 1)|tsl5 (assigned to previous version 7),ENSMUSG00000001089
Mecom,chr3,30060617,30060617,1,-,intron,448813,448813,10,134243,,15925,,,"G|intron_variant|MODIFIER|Mecom|ENSMUSG00000027684|Transcript|ENSMUST00000173495|protein_coding||1/15||||||||||-1||MGI|||4.440|",abnormal auditory brainstem response|abnormal locomotor activation|abnormal startle reflex|decreased erythrocyte cell number|decreased hemoglobin content|decreased lean body mass|decreased prepulse inhibition|increased blood urea nitrogen level|increased bone mineral content|increased circulating amylase level|increased lean body mass|increased startle reflex|increased total body fat amount|limb grasping|preweaning lethality complete penetrance|thrombocytopenia|abnormal amnion morphology|abnormal bone marrow cell morphology/development|abnormal common myeloid progenitor cell morphology|abnormal cranial ganglia morphology|abnormal craniofacial morphology|abnormal diencephalon morphology|abnormal fetal liver hematopoietic progenitor cell morphology|abnormal forebrain morphology|abnormal heart looping|abnormal heart morphology|abnormal hematopoietic precursor cell number|abnormal hematopoietic stem cell morphology|abnormal hematopoietic stem cell physiology|abnormal immune system organ morphology|abnormal limb development|abnormal liver bud morphology|abnormal mesonephros morphology|abnormal miscarriage rate|abnormal myotome development|abnormal neutrophil differentiation|abnormal pharyngeal arch morphology|abnormal pinna reflex|abnormal platelet morphology|abnormal spinal nerve morphology|abnormal superior glossopharyngeal ganglion morphology|abnormal superior vagus ganglion morphology|abnormal tympanic membrane morphology|abnormal vitelline vasculature morphology|absent hindlimb buds|absent myotome|absent paraxial mesoderm|absent sclerotome|brachydactyly|deafness|decreased B cell number|decreased body size|decreased body weight|decreased embryo size|decreased hematopoietic stem cell number|decreased leukocyte cell number|distended pericardium|double outlet right ventricle|edema|embryonic lethality during organogenesis complete penetrance|embryonic lethality during organogenesis incomplete penetrance|enlarged pericardium|hemorrhage|impaired hearing|incomplete somite formation|increased leukocyte cell number|increased sensitivity to xenobiotic induced morbidity/mortality|increased susceptibility to otitis media|interrupted aortic arch|kyphosis|lethality throughout fetal growth and development complete penetrance|lethality complete penetrance|malocclusion|middle ear effusion|middle ear polyps|no abnormal phenotype detected|overriding aortic valve|pale placenta|pale yolk sac|perinatal lethality complete penetrance|perinatal lethality incomplete penetrance|persistent truncus arteriosis|pharyngeal arch hypoplasia|polydactyly|postnatal growth retardation|postnatal lethality complete penetrance|pulmonary vascular congestion|respiratory system inflammation|skin edema|small embryonic telencephalon|small forelimb buds|small trigeminal ganglion|trabecula carnea hypoplasia|tympanic membrane perforation|ventricular septal defect|weakness|weight loss,C57BL/6NJ|C3H/HeH|"",DNA-binding transcription factor activity|negative regulation of programmed cell death|negative regulation of DNA-templated transcription|positive regulation of DNA-templated transcription|negative regulation of JNK cascade|regulation of cell cycle|histone deacetylase complex|nucleus|nuclear speck|in utero embryonic development|response to bacterium|positive regulation of transcription by RNA polymerase II|post-embryonic development|inflammatory response|RNA polymerase II cis-regulatory region sequence-specific DNA binding|DNA binding|cytoplasm|transferase activity|metal ion binding|regulation of transcription by RNA polymerase II|protein binding|methyltransferase activity|methylation|cell differentiation|histone modification|"DNA-binding transcription activator activity, RNA polymerase II-specific"|apoptotic process|neutrophil homeostasis|protein homodimerization activity|histone methyltransferase activity (H3-K9 specific)|heterochromatin organization|positive regulation of brown fat cell differentiation|embryonic hindlimb morphogenesis|forebrain development|RNA polymerase II transcription regulatory region sequence-specific DNA binding|pericardium development|hematopoietic stem cell proliferation|embryonic forelimb morphogenesis|ureter morphogenesis|maintenance of cell number|regulation of hematopoietic stem cell proliferation|"",DNA-templated transcription|regulation of DNA-templated transcription|transcription regulator activity|programmed cell death|signaling|organelle|nucleus|nucleoplasm|anatomical structure development|inflammatory response|DNA binding|catalytic activity|transferase activity|cell differentiation|protein modification process|immune system process|"catalytic activity, acting on a protein"|chromatin organization,R-MMU-162582|R-MMU-6807070|""|R-MMU-1257604|R-MMU-8943724|R-MMU-4839726|R-MMU-9006925|R-MMU-3247509|R-MMU-3214841,,"",,""|principal1,tsl1 (assigned to previous version 9)|tslNA (assigned to previous version 6)|tsl5 (assigned to previous version 9)|tsl5 (assigned to previous version 7)|tslNA (assigned to previous version 1)|tsl5 (assigned to previous version 1)|tsl1 (assigned to previous version 1)|tsl1 (assigned to previous version 7),ENSMUSG00000027684
Mecom,chr3,30060046,30060046,1,-,intron,449384,449384,9,134243,,15925,,,"A|intron_variant|MODIFIER|Mecom|ENSMUSG00000027684|Transcript|ENSMUST00000173495|protein_coding||1/15||||||||||-1||MGI|||4.410|",abnormal auditory brainstem response|abnormal locomotor activation|abnormal startle reflex|decreased erythrocyte cell number|decreased hemoglobin content|decreased lean body mass|decreased prepulse inhibition|increased blood urea nitrogen level|increased bone mineral content|increased circulating amylase level|increased lean body mass|increased startle reflex|increased total body fat amount|limb grasping|preweaning lethality complete penetrance|thrombocytopenia|abnormal amnion morphology|abnormal bone marrow cell morphology/development|abnormal common myeloid progenitor cell morphology|abnormal cranial ganglia morphology|abnormal craniofacial morphology|abnormal diencephalon morphology|abnormal fetal liver hematopoietic progenitor cell morphology|abnormal forebrain morphology|abnormal heart looping|abnormal heart morphology|abnormal hematopoietic precursor cell number|abnormal hematopoietic stem cell morphology|abnormal hematopoietic stem cell physiology|abnormal immune system organ morphology|abnormal limb development|abnormal liver bud morphology|abnormal mesonephros morphology|abnormal miscarriage rate|abnormal myotome development|abnormal neutrophil differentiation|abnormal pharyngeal arch morphology|abnormal pinna reflex|abnormal platelet morphology|abnormal spinal nerve morphology|abnormal superior glossopharyngeal ganglion morphology|abnormal superior vagus ganglion morphology|abnormal tympanic membrane morphology|abnormal vitelline vasculature morphology|absent hindlimb buds|absent myotome|absent paraxial mesoderm|absent sclerotome|brachydactyly|deafness|decreased B cell number|decreased body size|decreased body weight|decreased embryo size|decreased hematopoietic stem cell number|decreased leukocyte cell number|distended pericardium|double outlet right ventricle|edema|embryonic lethality during organogenesis complete penetrance|embryonic lethality during organogenesis incomplete penetrance|enlarged pericardium|hemorrhage|impaired hearing|incomplete somite formation|increased leukocyte cell number|increased sensitivity to xenobiotic induced morbidity/mortality|increased susceptibility to otitis media|interrupted aortic arch|kyphosis|lethality throughout fetal growth and development complete penetrance|lethality complete penetrance|malocclusion|middle ear effusion|middle ear polyps|no abnormal phenotype detected|overriding aortic valve|pale placenta|pale yolk sac|perinatal lethality complete penetrance|perinatal lethality incomplete penetrance|persistent truncus arteriosis|pharyngeal arch hypoplasia|polydactyly|postnatal growth retardation|postnatal lethality complete penetrance|pulmonary vascular congestion|respiratory system inflammation|skin edema|small embryonic telencephalon|small forelimb buds|small trigeminal ganglion|trabecula carnea hypoplasia|tympanic membrane perforation|ventricular septal defect|weakness|weight loss,C57BL/6NJ|C3H/HeH|"",DNA-binding transcription factor activity|negative regulation of programmed cell death|negative regulation of DNA-templated transcription|positive regulation of DNA-templated transcription|negative regulation of JNK cascade|regulation of cell cycle|histone deacetylase complex|nucleus|nuclear speck|in utero embryonic development|response to bacterium|positive regulation of transcription by RNA polymerase II|post-embryonic development|inflammatory response|RNA polymerase II cis-regulatory region sequence-specific DNA binding|DNA binding|cytoplasm|transferase activity|metal ion binding|regulation of transcription by RNA polymerase II|protein binding|methyltransferase activity|methylation|cell differentiation|histone modification|"DNA-binding transcription activator activity, RNA polymerase II-specific"|apoptotic process|neutrophil homeostasis|protein homodimerization activity|histone methyltransferase activity (H3-K9 specific)|heterochromatin organization|positive regulation of brown fat cell differentiation|embryonic hindlimb morphogenesis|forebrain development|RNA polymerase II transcription regulatory region sequence-specific DNA binding|pericardium development|hematopoietic stem cell proliferation|embryonic forelimb morphogenesis|ureter morphogenesis|maintenance of cell number|regulation of hematopoietic stem cell proliferation|"",DNA-templated transcription|regulation of DNA-templated transcription|transcription regulator activity|programmed cell death|signaling|organelle|nucleus|nucleoplasm|anatomical structure development|inflammatory response|DNA binding|catalytic activity|transferase activity|cell differentiation|protein modification process|immune system process|"catalytic activity, acting on a protein"|chromatin organization,R-MMU-162582|R-MMU-6807070|""|R-MMU-1257604|R-MMU-8943724|R-MMU-4839726|R-MMU-9006925|R-MMU-3247509|R-MMU-3214841,,"",,""|principal1,tsl1 (assigned to previous version 9)|tslNA (assigned to previous version 6)|tsl5 (assigned to previous version 9)|tsl5 (assigned to previous version 7)|tslNA (assigned to previous version 1)|tsl5 (assigned to previous version 1)|tsl1 (assigned to previous version 1)|tsl1 (assigned to previous version 7),ENSMUSG00000027684
Meis1,chr11,18946338,18946338,1,+,intron,65379,65379,32,72596,,71640,,,"C|intron_variant|MODIFIER|Meis1|ENSMUSG00000020160|Transcript|ENSMUST00000185131|protein_coding||7/11||||||||||-1||MGI|||4.010|",decreased prepulse inhibition|hyperactivity|increased bone mineral content|increased startle reflex|preweaning lethality complete penetrance|abnormal angiogenesis|abnormal blood vessel morphology|abnormal brain morphology|abnormal capillary branching pattern|abnormal capillary morphology|abnormal heart morphology|abnormal kidney morphology|abnormal liver morphology|abnormal lung morphology|abnormal megakaryocyte progenitor cell morphology|abnormal retina morphology|abnormal vascular branching morphogenesis|absent common myeloid progenitor cells|absent megakaryocytes|absent platelets|decreased common myeloid progenitor cell number|embryonic lethality during organogenesis complete penetrance|embryonic lethality during organogenesis incomplete penetrance|hemorrhage|impaired hematopoiesis|increased grip strength|lethality throughout fetal growth and development complete penetrance|liver hypoplasia|microphthalmia|pallor|small lens|ventricular septal defect,C57BL/6NJ|"",DNA binding|regulation of DNA-templated transcription|nucleus|sequence-specific DNA binding|protein binding|regulation of transcription by RNA polymerase II|RNA polymerase II cis-regulatory region sequence-specific DNA binding|chromatin binding|angiogenesis|locomotory behavior|"DNA-binding transcription factor activity, RNA polymerase II-specific"|"DNA-binding transcription activator activity, RNA polymerase II-specific"|positive regulation of transcription by RNA polymerase II|positive regulation of cell population proliferation|hemopoiesis|blood vessel morphogenesis|brain development|transcription regulator complex|nucleoplasm|negative regulation of neuron differentiation|animal organ morphogenesis|megakaryocyte development|definitive hemopoiesis|eye development|lens morphogenesis in camera-type eye|negative regulation of myeloid cell differentiation|embryonic pattern specification,DNA binding|DNA-templated transcription|regulation of DNA-templated transcription|organelle|nucleus|anatomical structure development|transcription regulator activity|immune system process|nucleoplasm|cell differentiation,"",201386|,"",,""|principal4|alternative1,tsl5 (assigned to previous version 10)|tsl1 (assigned to previous version 13)|tsl1 (assigned to previous version 7)|tsl5 (assigned to previous version 3)|tsl2 (assigned to previous version 7)|tsl1 (assigned to previous version 1)|tsl5 (assigned to previous version 7),ENSMUSG00000020160
Meis1,chr11,18900858,18900858,1,+,intron,151127,151127,31,72602,,,,,"C|intron_variant|MODIFIER|Meis1|ENSMUSG00000020160|Transcript|ENSMUST00000185131|protein_coding||9/11||||||||||-1||MGI|||4.210|",decreased prepulse inhibition|hyperactivity|increased bone mineral content|increased startle reflex|preweaning lethality complete penetrance|abnormal angiogenesis|abnormal blood vessel morphology|abnormal brain morphology|abnormal capillary branching pattern|abnormal capillary morphology|abnormal heart morphology|abnormal kidney morphology|abnormal liver morphology|abnormal lung morphology|abnormal megakaryocyte progenitor cell morphology|abnormal retina morphology|abnormal vascular branching morphogenesis|absent common myeloid progenitor cells|absent megakaryocytes|absent platelets|decreased common myeloid progenitor cell number|embryonic lethality during organogenesis complete penetrance|embryonic lethality during organogenesis incomplete penetrance|hemorrhage|impaired hematopoiesis|increased grip strength|lethality throughout fetal growth and development complete penetrance|liver hypoplasia|microphthalmia|pallor|small lens|ventricular septal defect,C57BL/6NJ|"",DNA binding|regulation of DNA-templated transcription|nucleus|sequence-specific DNA binding|protein binding|regulation of transcription by RNA polymerase II|RNA polymerase II cis-regulatory region sequence-specific DNA binding|chromatin binding|angiogenesis|locomotory behavior|"DNA-binding transcription factor activity, RNA polymerase II-specific"|"DNA-binding transcription activator activity, RNA polymerase II-specific"|positive regulation of transcription by RNA polymerase II|positive regulation of cell population proliferation|hemopoiesis|blood vessel morphogenesis|brain development|transcription regulator complex|nucleoplasm|negative regulation of neuron differentiation|animal organ morphogenesis|megakaryocyte development|definitive hemopoiesis|eye development|lens morphogenesis in camera-type eye|negative regulation of myeloid cell differentiation|embryonic pattern specification,DNA binding|DNA-templated transcription|regulation of DNA-templated transcription|organelle|nucleus|anatomical structure development|transcription regulator activity|immune system process|nucleoplasm|cell differentiation,"",201386|,"",,""|principal4|alternative1,tsl5 (assigned to previous version 10)|tsl1 (assigned to previous version 13)|tsl1 (assigned to previous version 7)|tsl5 (assigned to previous version 3)|tsl2 (assigned to previous version 7)|tsl1 (assigned to previous version 1)|tsl5 (assigned to previous version 7),ENSMUSG00000020160
