GENENAME,seqnames,start,end,width,strand,LOCATION,LOCSTART,LOCEND,QUERYID,TXID,CDSID,GENEID,PRECEDEID,FOLLOWID,CSQ,phenotype_description,strain_name,name_1006,goslim_goa_description,reactome,biogrid,rnacentral,rfam,transcript_appris,transcript_tsl,arrayexpress
Rora,chr9,68910502,68910502,1,-,intron,256530,256530,27,58173,,56707,,,"T|intron_variant|MODIFIER|Rora|ENSMUSG00000032238|Transcript|ENSMUST00000034766|protein_coding||1/10||||||||||1||MGI|||5.500|",increased circulating alkaline phosphatase level|preweaning lethality incomplete penetrance|Purkinje cell degeneration|abnormal Purkinje cell dendrite morphology|abnormal Purkinje cell differentiation|abnormal Purkinje cell morphology|abnormal brain interneuron morphology|abnormal brain morphology|abnormal cerebellar Purkinje cell layer|abnormal cerebellar foliation|abnormal cerebellar granule cell morphology|abnormal cerebellar granule layer morphology|abnormal cerebellar layer morphology|abnormal cerebellar molecular layer|abnormal cerebellum deep nucleus morphology|abnormal cerebellum external granule cell layer morphology|abnormal cerebellum morphology|abnormal cochlear VIII nucleus morphology|abnormal estrous cycle|abnormal excitatory postsynaptic currents|abnormal external female genitalia morphology|abnormal female reproductive system physiology|abnormal fertility/fecundity|abnormal gait|abnormal hormone level|abnormal immune system organ morphology|abnormal immune system physiology|abnormal inferior olivary complex morphology|abnormal limb posture|abnormal lipid homeostasis|abnormal lung compliance|abnormal macrophage physiology|abnormal maternal nurturing|abnormal motor capabilities/coordination/movement|abnormal motor learning|abnormal nervous system physiology|abnormal neuron proliferation|abnormal olfaction|abnormal olfactory bulb external plexiform layer morphology|abnormal olfactory bulb glomerular layer morphology|abnormal olfactory bulb granule cell layer morphology|abnormal olfactory bulb granule cell morphology|abnormal olfactory bulb internal plexiform layer morphology|abnormal olfactory bulb layer morphology|abnormal olfactory bulb mitral cell layer morphology|abnormal olfactory bulb morphology|abnormal olfactory bulb outer nerve layer morphology|abnormal radial glial cell morphology|abnormal respiratory mucosa morphology|abnormal sexual interaction|abnormal spatial learning|abnormal synaptic glutamate release|abnormal vasoconstriction|abnormal vasodilation|absent cerebellar granule cells|absent cerebellar granule layer|absent duvet hair|ataxia|atherosclerotic lesions|decreased Purkinje cell number|decreased aspartic acid level|decreased body size|decreased cerebellar granule cell number|decreased cerebellar granule cell precursor proliferation|decreased circulating HDL cholesterol level|decreased circulating cholesterol level|decreased gamma-aminobutyric acid level|decreased grip strength|decreased locomotor activity|decreased mean systemic arterial blood pressure|decreased taurine level|delaminated Purkinje cell layer|delayed estrous cycle|ectopic Purkinje cell|ectopic cerebellar granule cells|hindlimb paralysis|impaired balance|impaired coordination|impaired limb coordination|impaired righting response|increased IgE level|increased angiogenesis|increased interleukin-1 secretion|increased noradrenaline level|increased susceptibility to atherosclerosis|lethality at weaning incomplete penetrance|limb grasping|lung inflammation|postnatal lethality complete penetrance|postnatal lethality incomplete penetrance|prolonged estrus|prolonged metestrus|reduced cerebellar foliation|reduced female fertility|retarded hair growth|small cerebellum|small olfactory bulb|sparse hair|spleen atrophy|thin cerebellar granule layer|thin cerebellar molecular layer|thymus atrophy|tremors,C57BL/6NTac|C57BL/6NTAC|"",DNA binding|zinc ion binding|regulation of DNA-templated transcription|nucleus|DNA-binding transcription factor activity|sequence-specific DNA binding|nuclear receptor activity|cellular response to hypoxia|nucleolus|positive regulation of transcription by RNA polymerase II|cellular response to tumor necrosis factor|negative regulation of inflammatory response|RNA polymerase II cis-regulatory region sequence-specific DNA binding|angiogenesis|metal ion binding|regulation of transcription by RNA polymerase II|"DNA-binding transcription factor activity, RNA polymerase II-specific"|protein binding|positive regulation of DNA-templated transcription|regulation of gene expression|RNA polymerase II transcription regulatory region sequence-specific DNA binding|rhythmic process|negative regulation of I-kappaB kinase/NF-kappaB signaling|nucleoplasm|beta-catenin binding|circadian regulation of gene expression|transcription coregulator binding|cerebellar Purkinje cell differentiation|transcription coactivator binding|transcription corepressor binding|regulation of glucose metabolic process|regulation of macrophage activation|xenobiotic metabolic process|muscle cell differentiation|regulation of circadian rhythm|cholesterol homeostasis|regulation of smoothened signaling pathway|cellular response to interleukin-1|nitric oxide biosynthetic process|cerebellar granule cell precursor proliferation|cGMP metabolic process|positive regulation of vascular endothelial growth factor production|triglyceride homeostasis|intracellular receptor signaling pathway|positive regulation of circadian rhythm|oxysterol binding|ligand-activated transcription factor activity|regulation of steroid metabolic process|cellular response to sterol|negative regulation of fat cell differentiation|T-helper 17 cell differentiation|DNA-templated transcription,DNA binding|DNA-templated transcription|regulation of DNA-templated transcription|organelle|nucleus|transcription regulator activity|molecular transducer activity|signaling|nucleolus|inflammatory response|anatomical structure development|nucleoplasm|cell differentiation|carbohydrate metabolic process|immune system process|carbohydrate derivative metabolic process|nucleobase-containing small molecule metabolic process|lipid binding|lipid metabolic process,""|R-MMU-3108232|R-MMU-4090294|R-MMU-2990846|R-MMU-383280|R-MMU-73857|R-MMU-212436|R-MMU-392499|R-MMU-597592|R-MMU-74160,|202956,"",,principal1|"",tsl1 (assigned to previous version 2)|tsl1 (assigned to previous version 13)|tsl3 (assigned to previous version 7)|tsl2 (assigned to previous version 1)|tsl5 (assigned to previous version 1),ENSMUSG00000032238
Sall2,chr14,52313131,52313131,1,+,promoter,,,36,105969,,,,,"A|missense_variant|MODERATE|Sall2|ENSMUSG00000049532|Transcript|ENSMUST00000058326|protein_coding|2/2||||3193|2606|869|T/I|aCc/aTc|||-1||MGI||deleterious(0.02)|-0.707|",exencephaly|no abnormal phenotype detected|open neural tube|perinatal lethality incomplete penetrance,"",positive regulation of transcription by RNA polymerase II|nucleus|DNA binding|metal ion binding|RNA polymerase II cis-regulatory region sequence-specific DNA binding|regulation of transcription by RNA polymerase II|"DNA-binding transcription factor activity, RNA polymerase II-specific"|eye development|RNA polymerase II transcription regulatory region sequence-specific DNA binding|"DNA-binding transcription activator activity, RNA polymerase II-specific"|negative regulation of DNA-templated transcription|negative regulation of transcription by RNA polymerase II|neural tube development|protein-containing complex binding,DNA-templated transcription|regulation of DNA-templated transcription|organelle|nucleus|DNA binding|transcription regulator activity|anatomical structure development,"",206051|,"",,principal4|alternative1,tsl1 (assigned to previous version 4),ENSMUSG00000049532
Sall2,chr14,52315646,52315646,1,+,promoter,,,37,105969,,,,,"G|missense_variant|MODERATE|Sall2|ENSMUSG00000049532|Transcript|ENSMUST00000058326|protein_coding|2/2||||678|91|31|D/H|Gac/Cac|||-1||MGI||deleterious(0.01)|0.478|",exencephaly|no abnormal phenotype detected|open neural tube|perinatal lethality incomplete penetrance,"",positive regulation of transcription by RNA polymerase II|nucleus|DNA binding|metal ion binding|RNA polymerase II cis-regulatory region sequence-specific DNA binding|regulation of transcription by RNA polymerase II|"DNA-binding transcription factor activity, RNA polymerase II-specific"|eye development|RNA polymerase II transcription regulatory region sequence-specific DNA binding|"DNA-binding transcription activator activity, RNA polymerase II-specific"|negative regulation of DNA-templated transcription|negative regulation of transcription by RNA polymerase II|neural tube development|protein-containing complex binding,DNA-templated transcription|regulation of DNA-templated transcription|organelle|nucleus|DNA binding|transcription regulator activity|anatomical structure development,"",206051|,"",,principal4|alternative1,tsl1 (assigned to previous version 4),ENSMUSG00000049532
Shox2,chr3,66978365,66978365,1,+,promoter,,,11,20556,,66880,,,"G|missense_variant|MODERATE|Shox2|ENSMUSG00000027833|Transcript|ENSMUST00000029422|protein_coding|2/5||||591|376|126|D/H|Gat/Cat|||-1||MGI||deleterious(0.01)|0.326|",prenatal lethality prior to heart atrial septation|preweaning lethality complete penetrance|abnormal blood vessel morphology|abnormal heart development|abnormal heart morphology|abnormal palatal shelf fusion at midline|abnormal secondary palate development|abnormal sinoatrial node morphology|abnormal sinus venosus morphology|abnormal temporomandibular joint disk morphology|cleft secondary palate|decreased birth body size|decreased birth weight|decreased heart rate|embryonic lethality during organogenesis complete penetrance|embryonic lethality during organogenesis incomplete penetrance|irregular heartbeat|lethality throughout fetal growth and development complete penetrance|lethality throughout fetal growth and development incomplete penetrance|pericardial edema|postnatal lethality complete penetrance|postnatal lethality incomplete penetrance|slow postnatal weight gain,C57BL/6N|"",DNA binding|regulation of DNA-templated transcription|"DNA-binding transcription factor activity, RNA polymerase II-specific"|nucleus|regulation of transcription by RNA polymerase II|positive regulation of stem cell proliferation|stem cell proliferation|osteoblast differentiation|negative regulation of transcription by RNA polymerase II|chondrocyte differentiation|smoothened signaling pathway|"DNA-binding transcription repressor activity, RNA polymerase II-specific"|positive regulation of smoothened signaling pathway|sequence-specific double-stranded DNA binding|regulation of heart rate|cardiac atrium morphogenesis|embryonic forelimb morphogenesis|heart valve development|embryonic digestive tract morphogenesis|embryonic limb morphogenesis|chondrocyte development|positive regulation of mesenchymal cell proliferation|sequence-specific DNA binding|cartilage development involved in endochondral bone morphogenesis|mesenchymal cell proliferation|embryonic morphogenesis|embryonic skeletal joint morphogenesis|regulation of chondrocyte differentiation|sinoatrial node cell development|sinoatrial node development|sinoatrial valve development|cardiac right atrium morphogenesis|positive regulation of skeletal muscle fiber development|positive regulation of axonogenesis|muscle tissue morphogenesis|cardiac pacemaker cell differentiation|regulation of branching morphogenesis of a nerve,DNA binding|DNA-templated transcription|regulation of DNA-templated transcription|transcription regulator activity|organelle|nucleus|cell differentiation|anatomical structure development|signaling|circulatory system process,"",,"",,""|principal1,tsl1 (assigned to previous version 8)|tsl5 (assigned to previous version 1)|tsl1 (assigned to previous version 7)|tsl3 (assigned to previous version 8)|tsl1 (assigned to previous version 13),ENSMUSG00000027833
Sox6,chr7,115734350,115734350,1,-,intron,295992,295992,23,49869,,22419,,,"T|intron_variant|MODIFIER|Sox6|ENSMUSG00000051910|Transcript|ENSMUST00000072804|protein_coding||4/16||||||||||-1||MGI|||4.210|",abnormal sternum morphology|decreased body size|neonatal lethality incomplete penetrance|perinatal lethality incomplete penetrance|postnatal lethality complete penetrance|respiratory distress|respiratory failure,"",DNA binding|regulation of DNA-templated transcription|nucleus|transcription cis-regulatory region binding|DNA-binding transcription factor activity|protein homodimerization activity|brain development|positive regulation of chondrocyte differentiation|positive regulation of cartilage development|cellular response to transforming growth factor beta stimulus|negative regulation of cardiac muscle cell differentiation|positive regulation of mesenchymal stem cell differentiation|nucleoplasm|in utero embryonic development|sequence-specific DNA binding|protein binding|positive regulation of transcription by RNA polymerase II|gene expression|erythrocyte differentiation|post-embryonic development|regulation of gene expression|negative regulation of transcription by RNA polymerase II|cell morphogenesis|RNA polymerase II cis-regulatory region sequence-specific DNA binding|cartilage development|oligodendrocyte differentiation|regulation of DNA-binding transcription factor activity|cytoplasm|regulation of transcription by RNA polymerase II|"DNA-binding transcription factor activity, RNA polymerase II-specific"|cell differentiation|positive regulation of DNA-templated transcription|hemopoiesis|negative regulation of DNA-templated transcription|cis-regulatory region sequence-specific DNA binding|astrocyte differentiation|transcription regulator complex|"DNA-binding transcription repressor activity, RNA polymerase II-specific"|central nervous system development|cardiac muscle cell differentiation|cell fate commitment|erythrocyte development|chondrocyte differentiation|DNA-binding transcription repressor activity|cartilage condensation|spinal cord oligodendrocyte cell differentiation|oligodendrocyte cell fate specification,DNA binding|DNA-templated transcription|regulation of DNA-templated transcription|organelle|nucleus|transcription regulator activity|anatomical structure development|cell differentiation|nucleoplasm|immune system process,R-MMU-195721|R-MMU-162582|""|R-MMU-201681|R-MMU-3769402,203410|,"",,principal4|""|alternative1,tsl1 (assigned to previous version 10)|tsl1 (assigned to previous version 2)|tsl5 (assigned to previous version 1)|tsl5 (assigned to previous version 7)|tslNA (assigned to previous version 1)|tsl3 (assigned to previous version 1)|tsl1 (assigned to previous version 7)|tsl2 (assigned to previous version 1),ENSMUSG00000051910
Sox6,chr7,115827003,115827003,1,-,intron,203788,203788,24,49869,,22419,,,"G|intron_variant|MODIFIER|Sox6|ENSMUSG00000051910|Transcript|ENSMUST00000072804|protein_coding||2/16||||||||||-1||MGI|||4.060|",abnormal sternum morphology|decreased body size|neonatal lethality incomplete penetrance|perinatal lethality incomplete penetrance|postnatal lethality complete penetrance|respiratory distress|respiratory failure,"",DNA binding|regulation of DNA-templated transcription|nucleus|transcription cis-regulatory region binding|DNA-binding transcription factor activity|protein homodimerization activity|brain development|positive regulation of chondrocyte differentiation|positive regulation of cartilage development|cellular response to transforming growth factor beta stimulus|negative regulation of cardiac muscle cell differentiation|positive regulation of mesenchymal stem cell differentiation|nucleoplasm|in utero embryonic development|sequence-specific DNA binding|protein binding|positive regulation of transcription by RNA polymerase II|gene expression|erythrocyte differentiation|post-embryonic development|regulation of gene expression|negative regulation of transcription by RNA polymerase II|cell morphogenesis|RNA polymerase II cis-regulatory region sequence-specific DNA binding|cartilage development|oligodendrocyte differentiation|regulation of DNA-binding transcription factor activity|cytoplasm|regulation of transcription by RNA polymerase II|"DNA-binding transcription factor activity, RNA polymerase II-specific"|cell differentiation|positive regulation of DNA-templated transcription|hemopoiesis|negative regulation of DNA-templated transcription|cis-regulatory region sequence-specific DNA binding|astrocyte differentiation|transcription regulator complex|"DNA-binding transcription repressor activity, RNA polymerase II-specific"|central nervous system development|cardiac muscle cell differentiation|cell fate commitment|erythrocyte development|chondrocyte differentiation|DNA-binding transcription repressor activity|cartilage condensation|spinal cord oligodendrocyte cell differentiation|oligodendrocyte cell fate specification,DNA binding|DNA-templated transcription|regulation of DNA-templated transcription|organelle|nucleus|transcription regulator activity|anatomical structure development|cell differentiation|nucleoplasm|immune system process,R-MMU-195721|R-MMU-162582|""|R-MMU-201681|R-MMU-3769402,203410|,"",,principal4|""|alternative1,tsl1 (assigned to previous version 10)|tsl1 (assigned to previous version 2)|tsl5 (assigned to previous version 1)|tsl5 (assigned to previous version 7)|tslNA (assigned to previous version 1)|tsl3 (assigned to previous version 1)|tsl1 (assigned to previous version 7)|tsl2 (assigned to previous version 1),ENSMUSG00000051910
Sox6,chr7,115876579,115876579,1,-,intron,154212,154212,25,49869,,22419,,,"G|intron_variant|MODIFIER|Sox6|ENSMUSG00000051910|Transcript|ENSMUST00000072804|protein_coding||2/16||||||||||-1||MGI|||4.160|",abnormal sternum morphology|decreased body size|neonatal lethality incomplete penetrance|perinatal lethality incomplete penetrance|postnatal lethality complete penetrance|respiratory distress|respiratory failure,"",DNA binding|regulation of DNA-templated transcription|nucleus|transcription cis-regulatory region binding|DNA-binding transcription factor activity|protein homodimerization activity|brain development|positive regulation of chondrocyte differentiation|positive regulation of cartilage development|cellular response to transforming growth factor beta stimulus|negative regulation of cardiac muscle cell differentiation|positive regulation of mesenchymal stem cell differentiation|nucleoplasm|in utero embryonic development|sequence-specific DNA binding|protein binding|positive regulation of transcription by RNA polymerase II|gene expression|erythrocyte differentiation|post-embryonic development|regulation of gene expression|negative regulation of transcription by RNA polymerase II|cell morphogenesis|RNA polymerase II cis-regulatory region sequence-specific DNA binding|cartilage development|oligodendrocyte differentiation|regulation of DNA-binding transcription factor activity|cytoplasm|regulation of transcription by RNA polymerase II|"DNA-binding transcription factor activity, RNA polymerase II-specific"|cell differentiation|positive regulation of DNA-templated transcription|hemopoiesis|negative regulation of DNA-templated transcription|cis-regulatory region sequence-specific DNA binding|astrocyte differentiation|transcription regulator complex|"DNA-binding transcription repressor activity, RNA polymerase II-specific"|central nervous system development|cardiac muscle cell differentiation|cell fate commitment|erythrocyte development|chondrocyte differentiation|DNA-binding transcription repressor activity|cartilage condensation|spinal cord oligodendrocyte cell differentiation|oligodendrocyte cell fate specification,DNA binding|DNA-templated transcription|regulation of DNA-templated transcription|organelle|nucleus|transcription regulator activity|anatomical structure development|cell differentiation|nucleoplasm|immune system process,R-MMU-195721|R-MMU-162582|""|R-MMU-201681|R-MMU-3769402,203410|,"",,principal4|""|alternative1,tsl1 (assigned to previous version 10)|tsl1 (assigned to previous version 2)|tsl5 (assigned to previous version 1)|tsl5 (assigned to previous version 7)|tslNA (assigned to previous version 1)|tsl3 (assigned to previous version 1)|tsl1 (assigned to previous version 7)|tsl2 (assigned to previous version 1),ENSMUSG00000051910
Sox6,chr7,115541700,115541700,1,-,coding,1419,1419,22,62118,106225,20679,,,"A|missense_variant|MODERATE|Sox6|ENSMUSG00000051910|Transcript|ENSMUST00000072804|protein_coding|13/17||||1711|1542|514|Q/H|caA/caT|||-1||MGI||deleterious(0)|-7.810|",abnormal sternum morphology|decreased body size|neonatal lethality incomplete penetrance|perinatal lethality incomplete penetrance|postnatal lethality complete penetrance|respiratory distress|respiratory failure,"",DNA binding|regulation of DNA-templated transcription|nucleus|transcription cis-regulatory region binding|DNA-binding transcription factor activity|protein homodimerization activity|brain development|positive regulation of chondrocyte differentiation|positive regulation of cartilage development|cellular response to transforming growth factor beta stimulus|negative regulation of cardiac muscle cell differentiation|positive regulation of mesenchymal stem cell differentiation|nucleoplasm|in utero embryonic development|sequence-specific DNA binding|protein binding|positive regulation of transcription by RNA polymerase II|gene expression|erythrocyte differentiation|post-embryonic development|regulation of gene expression|negative regulation of transcription by RNA polymerase II|cell morphogenesis|RNA polymerase II cis-regulatory region sequence-specific DNA binding|cartilage development|oligodendrocyte differentiation|regulation of DNA-binding transcription factor activity|cytoplasm|regulation of transcription by RNA polymerase II|"DNA-binding transcription factor activity, RNA polymerase II-specific"|cell differentiation|positive regulation of DNA-templated transcription|hemopoiesis|negative regulation of DNA-templated transcription|cis-regulatory region sequence-specific DNA binding|astrocyte differentiation|transcription regulator complex|"DNA-binding transcription repressor activity, RNA polymerase II-specific"|central nervous system development|cardiac muscle cell differentiation|cell fate commitment|erythrocyte development|chondrocyte differentiation|DNA-binding transcription repressor activity|cartilage condensation|spinal cord oligodendrocyte cell differentiation|oligodendrocyte cell fate specification,DNA binding|DNA-templated transcription|regulation of DNA-templated transcription|organelle|nucleus|transcription regulator activity|anatomical structure development|cell differentiation|nucleoplasm|immune system process,R-MMU-195721|R-MMU-162582|""|R-MMU-201681|R-MMU-3769402,203410|,"",,principal4|""|alternative1,tsl1 (assigned to previous version 10)|tsl1 (assigned to previous version 2)|tsl5 (assigned to previous version 1)|tsl5 (assigned to previous version 7)|tslNA (assigned to previous version 1)|tsl3 (assigned to previous version 1)|tsl1 (assigned to previous version 7)|tsl2 (assigned to previous version 1),ENSMUSG00000051910
Spry4,chr18,38590681,38590681,1,+,promoter,,,46,127926,,,,,"A|missense_variant|MODERATE|Spry4|ENSMUSG00000024427|Transcript|ENSMUST00000025295|protein_coding|2/2||||321|28|10|V/F|Gtc/Ttc|||-1||MGI||deleterious(0.05)|0.828|",abnormal cornea morphology|abnormal digit morphology|brachydactyly|corneal opacity|decreased fasting circulating glucose level|decreased grip strength|hyperactivity|narrow eye opening|short tibia|abnormal incisor morphology|abnormal limb morphology|abnormal mandible morphology|decreased body weight|malocclusion|polysyndactyly|postnatal growth retardation|postnatal lethality incomplete penetrance|supernumerary teeth,C57BL/6NTAC|C57BL/6NTac|"",membrane|multicellular organism development|regulation of signal transduction|negative regulation of ERK1 and ERK2 cascade|cellular response to leukemia inhibitory factor|protein binding|cytoplasm|plasma membrane|cytosol|cell projection|negative regulation of substrate adhesion-dependent cell spreading|negative regulation of MAPK cascade|ruffle membrane|protein kinase inhibitor activity|negative regulation of MAP kinase activity|animal organ development|negative regulation of fibroblast growth factor receptor signaling pathway|negative regulation of Ras protein signal transduction,anatomical structure development|signaling|plasma membrane|cytosol|cell differentiation|cell adhesion|molecular function regulator activity|protein modification process,"",204878,"",,principal1,tsl1 (assigned to previous version 6),ENSMUSG00000024427
