GENENAME,seqnames,start,end,width,strand,LOCATION,LOCSTART,LOCEND,QUERYID,TXID,CDSID,GENEID,PRECEDEID,FOLLOWID,CSQ,phenotype_description,strain_name,name_1006,goslim_goa_description,reactome,biogrid,rnacentral,rfam,transcript_appris,transcript_tsl,arrayexpress
Aff3,chr1,38561921,38561921,1,-,intron,65168,65168,2,119199,,,,,"C|intron_variant|MODIFIER|Aff3|ENSMUSG00000037138|Transcript|ENSMUST00000095027|protein_coding||1/21||||||||||-1||MGI|||4.100|",abnormal incisor morphology|abnormal snout morphology|abnormal tooth morphology|abnormal vertebral arch morphology|decreased circulating fructosamine level|decreased circulating serum albumin level|decreased grip strength|fusion of vertebral arches|increased circulating alkaline phosphatase level|increased circulating chloride level|vertebral transformation|abnormal craniofacial morphology|abnormal fibula morphology|abnormal intestine morphology|abnormal nervous system physiology|abnormal pelvic girdle bone morphology|abnormal tibia morphology|decreased corpus callosum size|decreased fetal size|decreased length of long bones|delayed bone ossification|enlarged lateral ventricles|polydactyly|prenatal lethality,C57BL/6N|"",nucleus|regulation of gene expression|cytosol|nuclear body|nucleoplasm|DNA binding|DNA-binding transcription factor activity|DNA-templated transcription|regulation of DNA-templated transcription|double-stranded DNA binding|embryonic hindlimb morphogenesis|super elongation complex|response to tumor necrosis factor,organelle|nucleus|cytosol|nucleoplasm|DNA binding|DNA-templated transcription|regulation of DNA-templated transcription|transcription regulator activity|anatomical structure development,"",,"",,principal4|""|alternative2,""|tsl3 (assigned to previous version 2)|tsl1 (assigned to previous version 13)|tsl5 (assigned to previous version 8)|tsl5 (assigned to previous version 13)|tsl3 (assigned to previous version 1),ENSMUSG00000037138
Aff3,chr1,38587802,38587802,1,-,intron,39287,39287,3,119199,,,,,"A|intron_variant|MODIFIER|Aff3|ENSMUSG00000037138|Transcript|ENSMUST00000095027|protein_coding||1/21||||||||||-1||MGI|||5.770|",abnormal incisor morphology|abnormal snout morphology|abnormal tooth morphology|abnormal vertebral arch morphology|decreased circulating fructosamine level|decreased circulating serum albumin level|decreased grip strength|fusion of vertebral arches|increased circulating alkaline phosphatase level|increased circulating chloride level|vertebral transformation|abnormal craniofacial morphology|abnormal fibula morphology|abnormal intestine morphology|abnormal nervous system physiology|abnormal pelvic girdle bone morphology|abnormal tibia morphology|decreased corpus callosum size|decreased fetal size|decreased length of long bones|delayed bone ossification|enlarged lateral ventricles|polydactyly|prenatal lethality,C57BL/6N|"",nucleus|regulation of gene expression|cytosol|nuclear body|nucleoplasm|DNA binding|DNA-binding transcription factor activity|DNA-templated transcription|regulation of DNA-templated transcription|double-stranded DNA binding|embryonic hindlimb morphogenesis|super elongation complex|response to tumor necrosis factor,organelle|nucleus|cytosol|nucleoplasm|DNA binding|DNA-templated transcription|regulation of DNA-templated transcription|transcription regulator activity|anatomical structure development,"",,"",,principal4|""|alternative2,""|tsl3 (assigned to previous version 2)|tsl1 (assigned to previous version 13)|tsl5 (assigned to previous version 8)|tsl5 (assigned to previous version 13)|tsl3 (assigned to previous version 1),ENSMUSG00000037138
Aff3,chr1,38420894,38420894,1,+,intron,205375,205375,1,3694,,100033459,,,"C|intron_variant|MODIFIER|Aff3|ENSMUSG00000037138|Transcript|ENSMUST00000095027|protein_coding||4/21||||||||||-1||MGI|||4.340|",abnormal incisor morphology|abnormal snout morphology|abnormal tooth morphology|abnormal vertebral arch morphology|decreased circulating fructosamine level|decreased circulating serum albumin level|decreased grip strength|fusion of vertebral arches|increased circulating alkaline phosphatase level|increased circulating chloride level|vertebral transformation|abnormal craniofacial morphology|abnormal fibula morphology|abnormal intestine morphology|abnormal nervous system physiology|abnormal pelvic girdle bone morphology|abnormal tibia morphology|decreased corpus callosum size|decreased fetal size|decreased length of long bones|delayed bone ossification|enlarged lateral ventricles|polydactyly|prenatal lethality,C57BL/6N|"",nucleus|regulation of gene expression|cytosol|nuclear body|nucleoplasm|DNA binding|DNA-binding transcription factor activity|DNA-templated transcription|regulation of DNA-templated transcription|double-stranded DNA binding|embryonic hindlimb morphogenesis|super elongation complex|response to tumor necrosis factor,organelle|nucleus|cytosol|nucleoplasm|DNA binding|DNA-templated transcription|regulation of DNA-templated transcription|transcription regulator activity|anatomical structure development,"",,"",,principal4|""|alternative2,""|tsl3 (assigned to previous version 2)|tsl1 (assigned to previous version 13)|tsl5 (assigned to previous version 8)|tsl5 (assigned to previous version 13)|tsl3 (assigned to previous version 1),ENSMUSG00000037138
Basp1,chr15,25410826,25410826,1,+,promoter,,,38,110567,,,,,"A|intron_variant|MODIFIER|Basp1|ENSMUSG00000045763|Transcript|ENSMUST00000058845|protein_coding||1/1||||||||||-1||MGI|||5.600|",abnormal Schwann cell morphology|abnormal axon extension|abnormal axon morphology|abnormal cerebral cortex morphology|abnormal hippocampus morphology|abnormal motor nerve collateral sprouting|abnormal neurite morphology|abnormal neuromuscular synapse morphology|abnormal neuron morphology|decreased body weight|enlarged brain ventricles|hyperactivity|postnatal lethality incomplete penetrance,"",nucleus|cytoplasm|membrane|plasma membrane|growth cone|cell projection|cell junction|protein binding|nuclear speck|negative regulation of DNA-templated transcription|chromatin|transcription corepressor activity|protein domain specific binding|PML body|transcription cis-regulatory region binding|nuclear matrix|podocyte differentiation|COP9 signalosome,organelle|nucleus|plasma membrane|nucleoplasm|DNA-templated transcription|regulation of DNA-templated transcription|chromosome|transcription regulator activity|DNA binding|anatomical structure development|cell differentiation,R-MMU-194315|R-MMU-9012999|R-MMU-9716542|R-MMU-162582|""|R-MMU-9035034,213993|,"",,""|principal1,""|tsl1 (assigned to previous version 7),ENSMUSG00000045763
C2cd3,chr7,100451768,100451768,1,-,intron,22940,22940,21,49245,,,,,"A|missense_variant|MODERATE|C2cd3|ENSMUSG00000047248|Transcript|ENSMUST00000051777|protein_coding|30/33||||6009|5800|1934|Q/K|Caa/Aaa|||1||MGI||deleterious(0.01)|0.433|",abnormal embryo size|abnormal skin morphology|abnormal uterus morphology|embryonic growth retardation|embryonic lethality prior to tooth bud stage|enlarged urinary bladder|hyperactivity|preweaning lethality complete penetrance|abnormal cranial flexure morphology|abnormal direction of heart looping|abnormal dorsal-ventral axis patterning|abnormal floor plate morphology|abnormal left-right axis patterning|abnormal rostral-caudal body axis extension|absent embryonic cilia|embryonic lethality during organogenesis complete penetrance|exencephaly|pericardial edema|polydactyly,C57BL/6NCrl|"",in utero embryonic development|protein binding|cytoplasm|cell projection organization|cytoskeleton|cell projection|centriolar satellite|cilium|brain development|centriole|protein processing|centrosome|protein localization to centrosome|cilium assembly|ciliary basal body|neural tube development|embryonic digit morphogenesis|non-motile cilium assembly|pattern specification process|regulation of smoothened signaling pathway|heart looping|embryonic limb morphogenesis|regulation of proteolysis|neural plate axis specification|centriole elongation,anatomical structure development|organelle|cytoskeleton|microtubule organizing center|cilium|protein maturation|cilium organization|signaling|cytoskeleton organization,R-MMU-1852241|R-MMU-5620912|R-MMU-5617833|"",234966|,"",,""|alternative2|principal4,tsl3 (assigned to previous version 1)|tsl5 (assigned to previous version 8)|tsl5 (assigned to previous version 1)|tsl5 (assigned to previous version 14)|tslNA (assigned to previous version 1)|tsl1 (assigned to previous version 2)|tsl5 (assigned to previous version 10)|tsl1 (assigned to previous version 7)|tsl1 (assigned to previous version 8)|tsl2 (assigned to previous version 1),ENSMUSG00000047248
Camta1,chr4,151537841,151537841,1,+,promoter,,,13,29990,,230935,,,"T|intron_variant|MODIFIER|Camta1|ENSMUSG00000014592|Transcript|ENSMUST00000049790|protein_coding||4/23||||||||||-1||MGI|||5.410|",abnormal posture|ataxia|decreased body size|postnatal lethality complete penetrance,"",protein binding|regulation of transcription by RNA polymerase II|cytosol|nucleus|sequence-specific DNA binding|nucleolus|transcription coregulator activity|regulation of macromolecule metabolic process|cytoplasm|DNA-templated transcription|DNA binding|positive regulation of transcription by RNA polymerase II|neuromuscular process controlling balance|regulation of nitrogen compound metabolic process|positive regulation of calcineurin-NFAT signaling cascade|regulation of primary metabolic process|double-stranded DNA binding|positive regulation of protein dephosphorylation,DNA binding|DNA-templated transcription|regulation of DNA-templated transcription|organelle|nucleus|cytosol|transcription regulator activity|protein modification process|nervous system process|signaling|nucleolus,"",,"",,""|principal4|alternative2,tsl1 (assigned to previous version 7)|tsl5 (assigned to previous version 8)|tsl1 (assigned to previous version 1)|tsl5 (assigned to previous version 7)|tsl5 (assigned to previous version 13)|tsl3 (assigned to previous version 1)|tsl2 (assigned to previous version 1)|tsl1 (assigned to previous version 2),ENSMUSG00000014592
Camta1,chr4,151549275,151549275,1,+,promoter,,,14,29990,,230935,,,"T|intron_variant|MODIFIER|Camta1|ENSMUSG00000014592|Transcript|ENSMUST00000049790|protein_coding||4/23||||||||||-1||MGI|||6.960|",abnormal posture|ataxia|decreased body size|postnatal lethality complete penetrance,"",protein binding|regulation of transcription by RNA polymerase II|cytosol|nucleus|sequence-specific DNA binding|nucleolus|transcription coregulator activity|regulation of macromolecule metabolic process|cytoplasm|DNA-templated transcription|DNA binding|positive regulation of transcription by RNA polymerase II|neuromuscular process controlling balance|regulation of nitrogen compound metabolic process|positive regulation of calcineurin-NFAT signaling cascade|regulation of primary metabolic process|double-stranded DNA binding|positive regulation of protein dephosphorylation,DNA binding|DNA-templated transcription|regulation of DNA-templated transcription|organelle|nucleus|cytosol|transcription regulator activity|protein modification process|nervous system process|signaling|nucleolus,"",,"",,""|principal4|alternative2,tsl1 (assigned to previous version 7)|tsl5 (assigned to previous version 8)|tsl1 (assigned to previous version 1)|tsl5 (assigned to previous version 7)|tsl5 (assigned to previous version 13)|tsl3 (assigned to previous version 1)|tsl2 (assigned to previous version 1)|tsl1 (assigned to previous version 2),ENSMUSG00000014592
Cep152,chr2,125566233,125566233,1,+,promoter,,,6,12191,,58521,,,"C|missense_variant|MODERATE|Cep152|ENSMUSG00000068394|Transcript|ENSMUST00000089776|protein_coding|27/28||||4434|4189|1397|R/G|Cgg/Ggg|||-1||MGI||deleterious(0.03)|-2.050|",abnormal centrosome morphology|abnormal embryonic neuroepithelium morphology|decreased embryonic neuroepithelium primary cilium number|increased apoptosis,"",microtubule organizing center|centriole replication|de novo centriole assembly involved in multi-ciliated epithelial cell differentiation|deuterosome|nucleoplasm|cytoplasm|cell projection organization|protein binding|cytoskeleton|centriole|protein kinase binding|centrosome|pericentriolar material|procentriole|procentriole replication complex|centrosome duplication,organelle|cytoskeleton|microtubule organizing center|cytoskeleton organization|anatomical structure development|cell differentiation|nucleus|nucleoplasm,R-MMU-2565942|R-MMU-8854518|R-MMU-380259|R-MMU-5617833|R-MMU-380287|R-MMU-380320|R-MMU-380284|R-MMU-68886|R-MMU-69278|R-MMU-1852241|R-MMU-68877|R-MMU-1640170|R-MMU-380270|R-MMU-69275|R-MMU-5620912|R-MMU-453274,221186,"",,principal1,tsl1 (assigned to previous version 2),ENSMUSG00000068394
Cep250,chr2,155969338,155969338,1,+,promoter,,,7,13099,,16328,,,"T|missense_variant|MODERATE|Cep250|ENSMUSG00000038241|Transcript|ENSMUST00000109619|protein_coding|10/33||||1306|1106|369|S/L|tCg/tTg|||1||MGI||deleterious(0)|0.998|",abnormal auditory brainstem response|absent pinna reflex|increased total body fat amount|male infertility|abnormal electroretinogram waveform feature|abnormal retina blood vessel morphology|abnormal retina outer nuclear layer morphology|decreased a wave amplitude|decreased b wave amplitude|decreased total retina thickness|retina degeneration|retina photoreceptor degeneration|thin retina outer nuclear layer,C57BL/6N|"",cytoplasm|protein-containing complex|cell projection organization|cytoskeleton|cell projection|cilium|cell cycle|perinuclear region of cytoplasm|protein localization|centriole|protein kinase binding|protein localization to organelle|protein domain specific binding|centrosome|mitotic cell cycle|protein localization to centrosome|protein C-terminus binding|cilium assembly|ciliary basal body|spindle pole centrosome|centriole-centriole cohesion|photoreceptor inner segment|non-motile cilium assembly|photoreceptor outer segment|detection of light stimulus involved in visual perception|regulation of centriole-centriole cohesion|positive regulation of protein localization to centrosome,organelle|cytoskeleton|cilium|microtubule organizing center|mitotic cell cycle|cilium organization|cytoskeleton organization|nervous system process,R-MMU-69275|R-MMU-453274|R-MMU-2565942|R-MMU-380259|R-MMU-69278|R-MMU-380284|""|R-MMU-5617833|R-MMU-8854518|R-MMU-68877|R-MMU-1852241|R-MMU-68886|R-MMU-380270|R-MMU-5620912|R-MMU-380287|R-MMU-380320|R-MMU-1640170,200766|,"",,alternative2|""|principal2,tsl5 (assigned to previous version 13)|tsl1 (assigned to previous version 7)|tsl5 (assigned to previous version 10)|tsl5 (assigned to previous version 8)|tsl3 (assigned to previous version 7)|tsl5 (assigned to previous version 1)|tsl1 (assigned to previous version 1)|tsl3 (assigned to previous version 1)|tsl2 (assigned to previous version 7),ENSMUSG00000038241
Cep250,chr2,155990950,155990950,1,-,intron,16198,16198,8,130536,,338403,,,"A|missense_variant|MODERATE|Cep250|ENSMUSG00000038241|Transcript|ENSMUST00000109619|protein_coding|28/33||||4994|4794|1598|M/I|atG/atA|||1||MGI||deleterious(0.04)|-0.044|",abnormal auditory brainstem response|absent pinna reflex|increased total body fat amount|male infertility|abnormal electroretinogram waveform feature|abnormal retina blood vessel morphology|abnormal retina outer nuclear layer morphology|decreased a wave amplitude|decreased b wave amplitude|decreased total retina thickness|retina degeneration|retina photoreceptor degeneration|thin retina outer nuclear layer,C57BL/6N|"",cytoplasm|protein-containing complex|cell projection organization|cytoskeleton|cell projection|cilium|cell cycle|perinuclear region of cytoplasm|protein localization|centriole|protein kinase binding|protein localization to organelle|protein domain specific binding|centrosome|mitotic cell cycle|protein localization to centrosome|protein C-terminus binding|cilium assembly|ciliary basal body|spindle pole centrosome|centriole-centriole cohesion|photoreceptor inner segment|non-motile cilium assembly|photoreceptor outer segment|detection of light stimulus involved in visual perception|regulation of centriole-centriole cohesion|positive regulation of protein localization to centrosome,organelle|cytoskeleton|cilium|microtubule organizing center|mitotic cell cycle|cilium organization|cytoskeleton organization|nervous system process,R-MMU-69275|R-MMU-453274|R-MMU-2565942|R-MMU-380259|R-MMU-69278|R-MMU-380284|""|R-MMU-5617833|R-MMU-8854518|R-MMU-68877|R-MMU-1852241|R-MMU-68886|R-MMU-380270|R-MMU-5620912|R-MMU-380287|R-MMU-380320|R-MMU-1640170,200766|,"",,alternative2|""|principal2,tsl5 (assigned to previous version 13)|tsl1 (assigned to previous version 7)|tsl5 (assigned to previous version 10)|tsl5 (assigned to previous version 8)|tsl3 (assigned to previous version 7)|tsl5 (assigned to previous version 1)|tsl1 (assigned to previous version 1)|tsl3 (assigned to previous version 1)|tsl2 (assigned to previous version 7),ENSMUSG00000038241
Dnah6,chr6,73103254,73103254,1,+,promoter,,,18,45015,,,,,"A|missense_variant|MODERATE|Dnah6|ENSMUSG00000052861|Transcript|ENSMUST00000064948|protein_coding|43/77||||7021|6940|2314|L/F|Ctt/Ttt|||-1||MGI||deleterious(0.05)|-3.640|",abnormal kidney morphology|abnormal uterus morphology|enlarged heart|hydrometra,C57BL/6NCrl|"",ATP binding|microtubule-based movement|dynein complex|ATP hydrolysis activity|microtubule motor activity|dynein intermediate chain binding|dynein light intermediate chain binding|cilium movement|inner dynein arm|cytoskeleton|cell projection|cilium|microtubule|axoneme|minus-end-directed microtubule motor activity|cilium-dependent cell motility|axonemal dynein complex|cytoplasm|nucleotide binding,organelle|catalytic activity|hydrolase activity|ATP-dependent activity|cytoskeletal motor activity|microtubule-based movement|cell motility|cilium|cytoskeleton,"",,"",,""|principal1,tsl5 (assigned to previous version 7)|tsl5 (assigned to previous version 12)|tsl5 (assigned to previous version 1)|tsl1 (assigned to previous version 2),ENSMUSG00000052861
Drc3,chr11,60377867,60377867,1,+,coding,882,882,33,85956,149124|149123,74665,,,"T|missense_variant|MODERATE|Drc3|ENSMUSG00000056598|Transcript|ENSMUST00000108723|protein_coding|9/14||||1124|882|294|Q/H|caG/caT|||1||MGI||deleterious(0)|1.380|","","",protein binding|molecular_function|biological_process|cytoplasm|cytoskeleton|cell projection|cilium|motile cilium|axoneme|sperm flagellum,organelle|cytoskeleton|cilium,"",216923|,"",,alternative1|""|principal4,tsl5 (assigned to previous version 4)|tsl3 (assigned to previous version 7)|tsl1 (assigned to previous version 12)|tsl1 (assigned to previous version 8),ENSMUSG00000056598
Evc2,chr5,37357438,37357438,1,+,coding,639,639,15,35254,63244,68525,,,"G|missense_variant|MODERATE|Evc2|ENSMUSG00000050248|Transcript|ENSMUST00000056365|protein_coding|6/20||||688|639|213|I/M|atC/atG|||1||MGI||deleterious(0.01)|-0.429|",abnormal cecum morphology|abnormal gallbladder morphology|abnormal heart morphology|abnormal skin morphology|abnormal spleen morphology|abnormal uterus morphology|absent teeth|decreased body length|decreased grip strength|decreased prepulse inhibition|enlarged heart|hydrometra|increased circulating bilirubin level|preweaning lethality incomplete penetrance|small spleen|abnormal basicranium morphology|abnormal chondrocyte physiology|abnormal long bone epiphyseal plate morphology|abnormal long bone epiphyseal plate proliferative zone|decreased body weight|decreased bone mineral content|decreased trabecular bone volume|decreased width of hypertrophic chondrocyte zone|disproportionate dwarf|impaired osteoblast differentiation|microcephaly|no abnormal phenotype detected|perinatal lethality complete penetrance|short femur|short fibula|short humerus|short limbs|short radius|short ribs|short tibia|short ulna|slow postnatal weight gain|small cranium|small upper incisors,C57BL/6NCrl|"",smoothened signaling pathway|nucleus|cytoplasm|membrane|plasma membrane|cytoskeleton|cell projection|cilium|protein binding|plasma membrane protein complex|ciliary membrane,signaling|organelle|nucleus|plasma membrane|cytoskeleton|cilium,R-MMU-5632684|R-MMU-5358351|R-MMU-162582,,"",,""|principal1,tsl3 (assigned to previous version 1)|tsl1 (assigned to previous version 4)|tsl1 (assigned to previous version 8),ENSMUSG00000050248
Ext1,chr15,53079870,53079870,1,+,promoter,,,39,110941,,,,,"G|intron_variant|MODIFIER|Ext1|ENSMUSG00000061731|Transcript|ENSMUST00000077273|protein_coding||8/10||||||||||-1||MGI|||4.200|",abnormal developmental patterning|abnormal embryonic tissue morphology|abnormal extraembryonic tissue morphology|abnormal eye morphology|abnormal limb morphology|abnormal long bone epiphyseal plate proliferative zone|abnormal skeleton morphology|absent mesoderm|decreased embryo size|disorganized embryonic tissue|embryonic lethality|embryonic lethality between implantation and somite formation complete penetrance|failure of primitive streak formation|failure to gastrulate|increased osteochondroma incidence|no abnormal phenotype detected|premature death|prenatal lethality complete penetrance,"",integral component of membrane|glycosyltransferase activity|endoplasmic reticulum|protein glycosylation|glucuronosyltransferase activity|heparan sulfate proteoglycan biosynthetic process|gene expression|canonical Wnt signaling pathway|hematopoietic stem cell differentiation|multicellular organism growth|BMP signaling pathway|cell morphogenesis|regulation of blood pressure|ossification|cell population proliferation|cellular response to virus|response to virus|glandular epithelial cell differentiation|social behavior|"synaptic transmission, glutamatergic"|synapse|membrane|transferase activity|Golgi membrane|Golgi apparatus|metal ion binding|endoplasmic reticulum membrane|protein homodimerization activity|brain development|endoderm development|sulfation|protein heterodimerization activity|protein catabolic process|protein-containing complex assembly|hematopoietic progenitor cell differentiation|optic nerve development|bone resorption|hematopoietic stem cell homeostasis|collagen fibril organization|chondrocyte differentiation|neuron projection development|smoothened signaling pathway|cranial skeletal system development|cell adhesion|cell adhesion mediated by integrin|blood vessel remodeling|olfactory bulb development|epithelium development|fibroblast growth factor receptor signaling pathway|cellular response to fibroblast growth factor stimulus|tight junction organization|gastrulation|cell surface receptor signaling pathway|acetylglucosaminyltransferase activity|sodium ion homeostasis|stem cell division|vocalization behavior|cell fate commitment|ossification involved in bone maturation|chondrocyte proliferation|antigen processing and presentation|bone morphogenesis|dendritic cell migration|heart contraction|epithelial tube branching involved in lung morphogenesis|cellular response to BMP stimulus|axon guidance|hair cycle process|vasodilation|heparin biosynthetic process|motor behavior|wound healing|TNFSF11-mediated signaling pathway|glycosaminoglycan biosynthetic process|hair follicle morphogenesis|endochondral ossification|basement membrane organization|proteoglycan biosynthetic process|leukocyte tethering or rolling|limb joint morphogenesis|endochondral bone morphogenesis|glomerular basement membrane development|cartilage development involved in endochondral bone morphogenesis|mesoderm development|vacuole organization|response to light intensity|fear response|mesenchyme development|embryonic morphogenesis|neural crest cell differentiation|podocyte differentiation|multicellular organismal water homeostasis|developmental growth involved in morphogenesis|sebaceous gland development|response to growth factor|endochondral bone growth|mesenchymal cell differentiation involved in bone development|heparin metabolic process|glucuronosyl-N-acetylglucosaminyl-proteoglycan 4-alpha-N-acetylglucosaminyltransferase activity|N-acetylglucosaminyl-proteoglycan 4-beta-glucuronosyltransferase activity|"heparan sulfate proteoglycan biosynthetic process, polysaccharide chain biosynthetic process"|cellular polysaccharide biosynthetic process|fluid transport|stomach development|hypersensitivity|heart field specification|chondrocyte hypertrophy|cellular component organization|chondroitin sulfate metabolic process|lymphocyte adhesion to endothelial cell of high endothelial venule|smoothened signaling pathway involved in lung development|sweat gland development|perichondral bone morphogenesis|dendrite self-avoidance|response to heparin|embryonic skeletal joint development|lymphocyte migration into lymphoid organs|hematopoietic stem cell migration to bone marrow|bone growth|response to leukemia inhibitory factor,catalytic activity|transferase activity|organelle|endoplasmic reticulum|carbohydrate derivative metabolic process|protein modification process|protein glycosylation|signaling|immune system process|anatomical structure development|cell differentiation|circulatory system process|Golgi apparatus|sulfur compound metabolic process|protein catabolic process|protein-containing complex assembly|extracellular matrix organization|cell adhesion|cell junction organization|metal ion homeostasis|cell motility|wound healing|carbohydrate metabolic process|inflammatory response,R-MMU-71387|R-MMU-1630316|R-MMU-1430728|R-MMU-2022928|""|R-MMU-1638091,199556|,"",,principal1|"",tsl1 (assigned to previous version 8)|tsl3 (assigned to previous version 1)|tsl5 (assigned to previous version 7),ENSMUSG00000061731
